Topic,Count,Name,Representation,Representative_Docs
18,17,18_block_copolymer_membrane_paek,"['block', 'copolymer', 'membrane', 'paek', 'peg', 'paes', 'secondary', 'disclosed', 'lithium', 'fullsolidstate']","['Electrolyte membrane for lithium secondary battery and membrane-electrode structure for lithium secondary battery having the same Disclosed is an electrolyte membrane for a lithium secondary battery including a compound in which PEG is grafted to PAES or PAEK as a main chain or a block copolymer between PAES or PAEK and PEG, thereby to have excellent ionic conductivity and adhering property. Disclosed is a binder for a lithium secondary battery including a compound in which PEG is grafted to PAES or PAEK as a main chain or a block copolymer between PAES or PAEK and PEG, thereby to have excellent ionic conductivity and adhering property. Further, disclosed is a membrane-electrode structure for lithium secondary batteries having the electrolyte membrane and the binder. Further, disclosed is a manufacturing method of each of the electrolyte membrane, the binder, and the structure.', 'ELECTROLYTE MEMBRANE FOR LITHIUM SECONDARY BATTERY AND MEMBRANE-ELECTRODE STRUCTURE FOR LITHIUM SECONDARY BATTERY HAVING THE SAME Disclosed is an electrolyte membrane for a lithium secondary battery including a compound in which PEG is grafted to PAES or PAEK as a main chain or a block copolymer between PAES or PAEK and PEG, thereby to have excellent ionic conductivity and adhering property. Disclosed is a binder for a lithium secondary battery including a compound in which PEG is grafted to PAES or PAEK as a main chain or a block copolymer between PAES or PAEK and PEG, thereby to have excellent ionic conductivity and adhering property. Further, disclosed is a membrane-electrode structure for lithium secondary batteries having the electrolyte membrane and the binder. Further, disclosed is a manufacturing method of each of the electrolyte membrane, the binder, and the structure.', 'ELECTROLYTE MEMBRANE FOR LITHIUM SECONDARY BATTERY AND MEMBRANE-ELECTRODE STRUCTURE FOR LITHIUM SECONDARY BATTERY HAVING THE SAME Disclosed is an electrolyte membrane for a lithium secondary battery including a compound in which PEG is grafted to PAES or PAEK as a main chain or a block copolymer between PAES or PAEK and PEG, thereby to have excellent ionic conductivity and adhering property. Disclosed is a binder for a lithium secondary battery including a compound in which PEG is grafted to PAES or PAEK as a main chain or a block copolymer between PAES or PAEK and PEG, thereby to have excellent ionic conductivity and adhering property. Further, disclosed is a membrane-electrode structure for lithium secondary batteries having the electrolyte membrane and the binder. Further, disclosed is a manufacturing method of each of the electrolyte membrane, the binder, and the structure.']"
19,17,19_acryloyl_having_urethane_meth,"['acryloyl', 'having', 'urethane', 'meth', 'bond', 'photocurable', 'compound', 'component', 'ethylenically', 'group']","['All-solid-state battery and photo-curing composition for the all-solid-state battery A photo-curable composition, comprising a compound having 2 (meth) acryloyl groups and having no urethane bond and a photo-free radical polymerization initiator as a necessary component; and a compound having 1 (meth) acryloyl group and not having a urethane bond, a compound having a (meth) acryloyl group and a urethane bond, and other compound having an ethylenically unsaturated group as any component, the viscosity is more than 1Pa mPa.s and less than 100Pa mPa.s at 25 degrees centigrade. The curable composition is a material for forming a resin layer on at least a portion of a side surface of a laminated electrode body in a full-solid battery.', 'All-solid-state battery and photo-curing composition for the all-solid-state battery A photo-curable composition, comprising a compound having 2 (meth) acryloyl groups and having no urethane bond and a photo-free radical polymerization initiator as a necessary component; and a compound having 1 (meth) acryloyl group and not having a urethane bond, a compound having a (meth) acryloyl group and a urethane bond, and other compound having an ethylenically unsaturated group as any component, the viscosity is more than 1Pa mPa.s and less than 100Pa mPa.s at 25 degrees centigrade. The curable composition is a material for forming a resin layer on at least a portion of a side surface of a laminated electrode body in a full-solid battery.', 'All-solid-state battery and photo-curing composition for the all-solid-state battery A photo-curable composition, comprising a compound having 2 (meth) acryloyl groups and having no urethane bond and a photo-free radical polymerization initiator as a necessary component; and a compound having 1 (meth) acryloyl group and not having a urethane bond, a compound having a (meth) acryloyl group and a urethane bond, and other compound having an ethylenically unsaturated group as any component, the viscosity is more than 1Pa mPa.s and less than 100Pa mPa.s at 25 degrees centigrade. The curable composition is a material for forming a resin layer on at least a portion of a side surface of a laminated electrode body in a full-solid battery.']"
20,16,20_polycyclohexadiene_polyarylene_suitable_process,"['polycyclohexadiene', 'polyarylene', 'suitable', 'process', 'major', 'converted', 'treating', 'rings', 'portion', 'treatment']","['Polymer coatings A process for the preparation of a polymer composition which comprises a polyarylene which process comprises treating a first composition comprising a polycyclohexadiene, a suitable additive and a solvent for the polycyclohexadiene to a suitable heat treatment such that at least a major portion of the cyclohexenylene rings in the polycyclohexadiene are converted into aromatic groups.', 'Polymer coatings A process for the preparation of a polymer composition which comprises a polyarylene which process comprises treating a first composition comprising a polycyclohexadiene, a suitable additive and a solvent for the polycyclohexadiene to a suitable heat treatment such that at least a major portion of the cyclohexenylene rings in the polycyclohexadiene are converted into aromatic groups.', 'Polymer coatings A process for the preparation of a polymer composition which comprises a polyarylene which process comprises treating a first composition comprising a polycyclohexadiene, a suitable additive and a solvent for the polycyclohexadiene to a suitable heat treatment such that at least a major portion of the cyclohexenylene rings in the polycyclohexadiene are converted into aromatic groups.']"
21,16,21_copolyester_particulate_film_dicarboxylic,"['copolyester', 'particulate', 'film', 'dicarboxylic', 'further', 'films', 'repeating', 'from', 'ions', 'metalion']","['COPOLYESTER FILMS FOR USE AS SEPARATORS IN METAL-ION BATTERIES A copolyester film comprising a copolyester which comprises repeating units derived from a diol, a dicarboxylic acid and a poly(alkylene oxide), wherein the copolyester film further comprises a first metal ion-containing component selected from conductive ceramic particulate materials, and wherein the film may further comprise additional metal ions from one or more sources other than said conductive ceramic particulate material.', 'COPOLYESTER FILMS FOR USE AS SEPARATORS IN METAL-ION BATTERIES A copolyester film comprising a copolyester which comprises repeating units derived from a diol, a dicarboxylic acid and a poly(alkylene oxide), wherein the copolyester film further comprises a first metal ion-containing component selected from conductive ceramic particulate materials, and wherein the film may further comprise additional metal ions from one or more sources other than said conductive ceramic particulate material.', 'COPOLYESTER FILMS FOR USE AS SEPARATORS IN METAL-ION BATTERIES A copolyester film comprising a copolyester which comprises repeating units derived from a diol, a dicarboxylic acid and a poly(alkylene oxide), wherein the copolyester film further comprises a first metal ion-containing component selected from conductive ceramic particulate materials, and wherein the film may further comprise additional metal ions from one or more sources other than said conductive ceramic particulate material.']"
22,16,22_backbone_binders_embodiments_01,"['backbone', 'binders', 'embodiments', '01', 'some', 'polar', 'include', 'functional', 'that', 'polymer']","['COMPOSITE ELECTROLYTES WITH BINDERS Functionalized polymeric binders for electrolyte and electrode compositions include a polymer having a polymer backbone and functional groups. In some embodiments, a polymer includes a non-polar polymer backbone and a functional group that is 0.1 to 5 wt % of the polymer. In some embodiments, a polymer includes a polar backbone and a functional group that is 0.1 to 50% weight percent of the polymer. Also described are composites for electrolyte separators and electrodes that include argyrodite ion conductors and polar polymers.', 'Composite electrolytes with binders Functionalized polymeric binders for electrolyte and electrode compositions include a polymer having a polymer backbone and functional groups. In some embodiments, a polymer includes a non-polar polymer backbone and a functional group that is 0.1 to 5 wt % of the polymer. In some embodiments, a polymer includes a polar backbone and a functional group that is 0.1 to 50% weight percent of the polymer. Also described are composites for electrolyte separators and electrodes that include argyrodite ion conductors and polar polymers.', 'COMPOSITE ELECTROLYTES WITH BINDERS Functionalized polymeric binders for electrolyte and electrode compositions include a polymer having a polymer backbone and functional groups. In some embodiments, a polymer includes a non-polar polymer backbone and a functional group that is 0.1 to 5 wt % of the polymer. In some embodiments, a polymer includes a polar backbone and a functional group that is 0.1 to 50% weight percent of the polymer. Also described are composites for electrolyte separators and electrodes that include argyrodite ion conductors and polar polymers.']"
23,16,23_polyimide_aqueous_precursorcontaining_porous,"['polyimide', 'aqueous', 'precursorcontaining', 'porous', 'precursor', 'water', 'solvent', 'aprotic', 'polyalkylene', 'composition']","['Polyimide precursor containing aqueous composition; the manufacturing method of polyimide membrane; \\nAnd the manufacturing method of a porous polyimide membrane PROBLEM TO BE SOLVED: To provide a polyimide precursor-containing aqueous composition that gives a porous polyimide film with a reduced number of coarse holes.  SOLUTION: A polyimide precursor-containing aqueous composition contains a polyimide precursor, resin particles having polyalkylene oxide groups, and a solvent containing water and an aprotic polar solvent.  SELECTED DRAWING: None', 'Polyimide precursor containing aqueous composition; the manufacturing method of polyimide membrane; \\nAnd the manufacturing method of a porous polyimide membrane PROBLEM TO BE SOLVED: To provide a polyimide precursor-containing aqueous composition that gives a porous polyimide film with a reduced number of coarse holes.  SOLUTION: A polyimide precursor-containing aqueous composition contains a polyimide precursor, resin particles having polyalkylene oxide groups, and a solvent containing water and an aprotic polar solvent.  SELECTED DRAWING: None', 'Polyimide precursor containing aqueous composition; the manufacturing method of polyimide membrane; \\nAnd the manufacturing method of a porous polyimide membrane PROBLEM TO BE SOLVED: To provide a polyimide precursor-containing aqueous composition that gives a porous polyimide film with a reduced number of coarse holes.  SOLUTION: A polyimide precursor-containing aqueous composition contains a polyimide precursor, resin particles having polyalkylene oxide groups, and a solvent containing water and an aprotic polar solvent.  SELECTED DRAWING: None']"
24,15,24_height_figure_overall_structural,"['height', 'figure', 'overall', 'structural', 'derived', 'electrode', 'negative', 'conjugate', 'the', 'binding']","['The slurry for the binding agent composition for the overall height figure battery and overall height figure cell electrode. The invention can form the electrode layer having the high workability. Simultaneously it is done by the purpose providing the binding agent composition for the binding agent composition for the overall height figure battery forming the electrode layer in which the high adhesion for the solid electrolyte layer and current collector is obtained and the overall height figure battery providing the slurry for the overall height figure cell electrode. The binder resin, including the hydrogenation conjugate diene group polymer in which the polymer in which the binding agent composition for the overall height figure battery of the invention is selected from the polymer (a1) of the following and polymer (a2) of the following is hydrogen-added and the hydrogen addition rate is 70 ％ or greater and non-polar liquid organic vehicle are contained: the random copolymer in which it contains the structure unit derived from the polymer - polymer (a2) conjugate diene compound including only the structure unit derived from - polymer (a1) conjugate diene compound except the block polymer and the structure unit derived from the aromatic vinyl compound and the content of 1,2- vinyl bonding among the structure unit derived from the conjugate diene compound is 70 mol％ or less and the containing rate of the structure unit derived from the aromatic vinyl compound is 40 mass ％ under.', 'The slurry for the binding agent composition for the overall height figure battery and overall height figure cell electrode. The invention can form the electrode layer having the high workability. Simultaneously it is done by the purpose providing the binding agent composition for the binding agent composition for the overall height figure battery forming the electrode layer in which the high adhesion for the solid electrolyte layer and current collector is obtained and the overall height figure battery providing the slurry for the overall height figure cell electrode. The binder resin, including the hydrogenation conjugate diene group polymer in which the polymer in which the binding agent composition for the overall height figure battery of the invention is selected from the polymer (a1) of the following and polymer (a2) of the following is hydrogen-added and the hydrogen addition rate is 70 ％ or greater and non-polar liquid organic vehicle are contained: the random copolymer in which it contains the structure unit derived from the polymer - polymer (a2) conjugate diene compound including only the structure unit derived from - polymer (a1) conjugate diene compound except the block polymer and the structure unit derived from the aromatic vinyl compound and the content of 1,2- vinyl bonding among the structure unit derived from the conjugate diene compound is 70 mol％ or less and the containing rate of the structure unit derived from the aromatic vinyl compound is 40 mass ％ under.', 'The slurry for the binding agent composition for the overall height figure battery and overall height figure cell electrode. The invention can form the electrode layer having the high workability. Simultaneously it is done by the purpose providing the binding agent composition for the binding agent composition for the overall height figure battery forming the electrode layer in which the high adhesion for the solid electrolyte layer and current collector is obtained and the overall height figure battery providing the slurry for the overall height figure cell electrode. The binder resin, including the hydrogenation conjugate diene group polymer in which the polymer in which the binding agent composition for the overall height figure battery of the invention is selected from the polymer (a1) of the following and polymer (a2) of the following is hydrogen-added and the hydrogen addition rate is 70 ％ or greater and non-polar liquid organic vehicle are contained: the random copolymer in which it contains the structure unit derived from the polymer - polymer (a2) conjugate diene compound including only the structure unit derived from - polymer (a1) conjugate diene compound except the block polymer and the structure unit derived from the aromatic vinyl compound and the content of 1,2- vinyl bonding among the structure unit derived from the conjugate diene compound is 70 mol％ or less and the containing rate of the structure unit derived from the aromatic vinyl compound is 40 mass ％ under.']"
25,15,25_methacrylic_resin_ester_vehicle,"['methacrylic', 'resin', 'ester', 'vehicle', 'acid', 'binder', 'electronic', 'as', 'formula', 'solvent']","[""The solvent for acryl binder resins PROBLEM TO BE SOLVED: To provide a solvent for an acrylic binder resin which controls solubility of a (meth)acrylic resin and enables preparation of a vehicle solution preventing sheet attack, in a vehicle solution for forming a multilayer laminate device containing a (meth)acrylic resin as a main binder and including an electrode layer and a dielectric layer.  SOLUTION: At least a solvent for an acrylic binder resin is contained as a solvent in a vehicle solution for forming a multilayer laminate device containing a (meth)acrylic resin as a binder and including an electrode layer and a dielectric layer, in which the solvent for the acrylic binder resin is an isoprene derivative represented by formula (I), in the formula, R and R' are each independently a hydrogen atom or an acyl group having 1 to 4 carbon atoms.  SELECTED DRAWING: None"", ""The solvent for acryl binder resins PROBLEM TO BE SOLVED: To provide a solvent for an acrylic binder resin which controls solubility of a (meth)acrylic resin and enables preparation of a vehicle solution preventing sheet attack, in a vehicle solution for forming a multilayer laminate device containing a (meth)acrylic resin as a main binder and including an electrode layer and a dielectric layer.  SOLUTION: At least a solvent for an acrylic binder resin is contained as a solvent in a vehicle solution for forming a multilayer laminate device containing a (meth)acrylic resin as a binder and including an electrode layer and a dielectric layer, in which the solvent for the acrylic binder resin is an isoprene derivative represented by formula (I), in the formula, R and R' are each independently a hydrogen atom or an acyl group having 1 to 4 carbon atoms.  SELECTED DRAWING: None"", ""The solvent for acryl binder resins PROBLEM TO BE SOLVED: To provide a solvent for an acrylic binder resin which controls solubility of a (meth)acrylic resin and enables preparation of a vehicle solution preventing sheet attack, in a vehicle solution for forming a multilayer laminate device containing a (meth)acrylic resin as a main binder and including an electrode layer and a dielectric layer.  SOLUTION: At least a solvent for an acrylic binder resin is contained as a solvent in a vehicle solution for forming a multilayer laminate device containing a (meth)acrylic resin as a binder and including an electrode layer and a dielectric layer, in which the solvent for the acrylic binder resin is an isoprene derivative represented by formula (I), in the formula, R and R' are each independently a hydrogen atom or an acyl group having 1 to 4 carbon atoms.  SELECTED DRAWING: None""]"
26,14,26_polyurethane_hexagonal_casting_ferrite,"['polyurethane', 'hexagonal', 'casting', 'ferrite', 'type', 'composite', 'material', 'nano', 'filler', 'obviously']","['Pouring type polyurethane composite material and preparation method and application thereof The invention belongs to the technical field of composite material, specifically relates to a casting type polyurethane composite material and preparation method and application thereof. wherein the casting type polyurethane composite material comprises a casting type polyurethane substrate and nano hexagonal system ferrite uniformly dispersed in the casting type polyurethane, the mass ratio of the nano hexagonal system ferrite in the composite material is 0.1-8 %. The nano hexagonal ferrite of the invention has a unique hexagonal structure, with good compatibility with the casting type polyurethane precursor, promoting uniform dispersion of the filler in the polyurethane matrix, uniformly dispersing and improving the crosslinking of the polyurethane molecule, so that the prepared composite material structure is compact, and the mechanical property is excellent. after adding nano hexagonal ferrite filler, strain energy density and hysteresis energy density of the polyurethane composite material is obviously increased, and hysteresis loss H index of the composite material is almost unchanged. The invention exerts magnetic field in the casting process, which can obviously enhance the adhesive force.', 'Pouring type polyurethane composite material and preparation method and application thereof The invention belongs to the technical field of composite material, specifically relates to a casting type polyurethane composite material and preparation method and application thereof. wherein the casting type polyurethane composite material comprises a casting type polyurethane substrate and nano hexagonal system ferrite uniformly dispersed in the casting type polyurethane, the mass ratio of the nano hexagonal system ferrite in the composite material is 0.1-8 %. The nano hexagonal ferrite of the invention has a unique hexagonal structure, with good compatibility with the casting type polyurethane precursor, promoting uniform dispersion of the filler in the polyurethane matrix, uniformly dispersing and improving the crosslinking of the polyurethane molecule, so that the prepared composite material structure is compact, and the mechanical property is excellent. after adding nano hexagonal ferrite filler, strain energy density and hysteresis energy density of the polyurethane composite material is obviously increased, and hysteresis loss H index of the composite material is almost unchanged. The invention exerts magnetic field in the casting process, which can obviously enhance the adhesive force.', 'Pouring type polyurethane composite material and preparation method and application thereof The invention belongs to the technical field of composite material, specifically relates to a casting type polyurethane composite material and preparation method and application thereof. wherein the casting type polyurethane composite material comprises a casting type polyurethane substrate and nano hexagonal system ferrite uniformly dispersed in the casting type polyurethane, the mass ratio of the nano hexagonal system ferrite in the composite material is 0.1-8 %. The nano hexagonal ferrite of the invention has a unique hexagonal structure, with good compatibility with the casting type polyurethane precursor, promoting uniform dispersion of the filler in the polyurethane matrix, uniformly dispersing and improving the crosslinking of the polyurethane molecule, so that the prepared composite material structure is compact, and the mechanical property is excellent. after adding nano hexagonal ferrite filler, strain energy density and hysteresis energy density of the polyurethane composite material is obviously increased, and hysteresis loss H index of the composite material is almost unchanged. The invention exerts magnetic field in the casting process, which can obviously enhance the adhesive force.']"
